Hotels,Prices,Total_Price,Ratings,Booking_Discounts(%),Reviews,Facilities,Address,Informations,City_Name
Flagship 86894 Tambaram,1167.1512605042017,3815.18487394958,4.173529411764706,68.73949579831933,1297.0, AC ,"Near Tambaram Railwaystation, Tambaram, Chennai",15 people booked this hotel today,Chennai
OYO 90966 Dakshin Serviced Apartment,1167.1512605042017,3815.18487394958,4.173529411764706,68.73949579831933,49.0, Hair Dryer ,"3rd south cross street,Neelangarai",,Chennai
Flagship 36726 Chellam Residency,1167.1512605042017,3815.18487394958,4.173529411764706,68.73949579831933,399.0, Reception ,"Near Arumbakkam Megamart, Sai Chellam Complex, Chennai",1k+ people booked this OYO in last 6 months,Chennai
Flagship 92574 G Cloud,1167.1512605042017,3815.18487394958,4.173529411764706,68.73949579831933,128.0, Parking facility ,"Hasthinapuram Chrompe, Chennai",,Chennai
Townhouse 1155 Porur,1167.1512605042017,3815.18487394958,4.173529411764706,68.73949579831933,13.0, Parking facility ,Opposite Chandra Metro mall Near Porur Bridge,,Chennai
OYO Townhouse 237 Near Pallavaram - Thoraipakkam Road,1167.1512605042017,3815.18487394958,4.173529411764706,68.73949579831933,4248.0, Private entrance ,"Near bus stop, Kovilambakkam, Chennai",All staff vaccinated with 1st dose,Chennai
